{
  "$schema": "./schema.json",
  "solLogo": "https://raw.githubusercontent.com/ilyasbozdemir/workdesk-360/main/public/icon.png",
  "sagLogo": "https://upload.wikimedia.org/wikipedia/commons/0/0f/Logo_of_100th_years_of_the_Republic_of_T%C3%BCrkiye.svg",
  "antetSatir1": "KAŞ BELEDİYE BAŞKANLIĞI",
  "kurumAdi": "Kaş Belediye Başkanlığı",
  "muhasebeBirimKodu": "07.41.02",
  "muhasebeBirimAdi": "Kaş Belediyesi Muhasebe Birimi",
  "butceYili": "2026",
  "yukleniciFirma": "Acme İnş. Tic. ve San. Ltd. Şti.",
  "yevmiyeTarihi": "23/06/2026",
  "yevmiyeNo": "1428",
  "yukleniciVergiNo": "2421159017",
  "yukleniciBankaSube": "Ziraat Bankası - Kaş Şubesi",
  "yukleniciIban": "TR56 0001 0007 4102 3456 7890 01",
  "kurumKoduIl": "07",
  "kurumKoduIlce": "41",
  "kurumKoduKurum": "137209",
  "kurumKoduBirim": "08",
  "yukleniciVergiDairesi": "KAŞ",
  "birimAdi": "Fen İşleri Müdürlüğü",
  "yukleniciAdres": "Andifli Mah. Hükümet Cad. No:12 Kaş / Antalya",
  "dosyaKonusu": "Belediyemiz Park ve Bahçeler Müdürlüğü Hizmet Binası Çatı Onarımı ve Çevre Düzenleme İşi",
  "hesapNo1": "830",
  "kurumsal1": "57",
  "kurumsal2": "31",
  "kurumsal3": "__",
  "kurumsal4": "__",
  "fonk1": "01",
  "fonk2": "3",
  "fonk3": "9",
  "fonk4": "00",
  "finKod": "1",
  "eko1": "03",
  "eko2": "5",
  "eko3": "1",
  "eko4": "90",
  "brutTutarTL": "408.183",
  "brutTutarKR": "06",
  "damgaVergisiTL": "3.224",
  "damgaVergisiKR": "65",
  "ihaleKarariDamgaVergisiTL": "1.935",
  "ihaleKarariDamgaVergisiKR": "47",
  "gelirVergisiTL": "0",
  "gelirVergisiKR": "00",
  "kdvTevkifatTL": "20.409",
  "kdvTevkifatKR": "18",
  "giderYansitmaTL": "408.183",
  "giderYansitmaKR": "06",
  "gelirYansitmaTL": "408.183",
  "gelirYansitmaKR": "06",
  "toplamBorcTL": "816.366",
  "toplamBorcKR": "12",
  "toplamAlacakTL": "841.936",
  "toplamAlacakKR": "50",
  "onayTarih1": "23/06/2026",
  "kontrolEdenAdi": "Selin KAYA",
  "kontrolEdenUnvan": "Mali Hizmetler Müdürü",
  "odemeEmriBelgeNo": "2026-OEM-4321",
  "cekGondermeEmirNo": "CG-789012",
  "kesintiToplamTL": "25.569",
  "kesintiToplamKR": "30",
  "netOdenenTL": "382.613",
  "netOdenenKR": "76",
  "tetkikEdenMemur": "Ali YILDIZ",
  "tetkikEdenSef": "Fatma GÜNEŞ",
  "tetkikEdenMuhYetYrd": "Veli ÖZTÜRK",
  "aciklamalar": "Dosya ekleri (fatura, muayene kabul tutanağı) kontrol edilerek tahakkuka bağlanmıştır.",
  "faturaTarihi": "20/06/2026",
  "faturaNo": "A-202600001928",
  "netOdenenYazi": "ÜÇYÜZSEKSENİKİBİN ALTİYÜZONÜÇ TL YETMİŞALTI KURUŞ",
  "gerceklestirmeGorevlisiAdi": "Mustafa YILMAZ",
  "gerceklestirmeGorevlisiUnvan": "Destek Hizmetleri Müdürü",
  "olurTarihi": "24/06/2026",
  "olurKisiAdi": "Mehmet ARI",
  "olurKisiUnvan": "Mali Hizmetler Müdürü",
  "odeyinizKisiAdi": "Halil KOCAER",
  "odeyinizKisiUnvan": "Belediye Başkanı",
  "hazirlayanPersonelAdi": "Mustafa YILMAZ",
  "hazirlayanPersonelUnvan": "Destek Hizmetleri Müdürü",
  "onaylayanPersonelAdi": "Mehmet ARI",
  "onaylayanPersonelUnvan": "Mali Hizmetler Müdürü",
  "baskanAdi": "Halil KOCAER",
  "baskanUnvan": "Belediye Başkanı"
}
